{
  "$schema": "https://json-schema.org/draft/2020-12/schema",
  "$id": "https://schemas.globalgovernanceframeworks.org/imt/0.9/implementation-methods-tools-framework-v0.9.schema.json",
  "title": "IMT v0.9 record envelope",
  "type": "object",
  "required": [
    "record_id",
    "record_type",
    "schema_version",
    "created_at",
    "status",
    "normative_force",
    "authority_effect",
    "action_class",
    "source_framework_id",
    "source_framework_version",
    "actor_id",
    "actor_type",
    "affected_party_refs",
    "protected_domain_flags",
    "access_class",
    "public_summary",
    "data_purpose",
    "correction_status",
    "challenge_status",
    "closure_state",
    "handoff_state",
    "hashes_and_signatures",
    "human_accountable_officer",
    "prohibited_inferences",
    "consequence_profile",
    "imt_payload"
  ],
  "properties": {
    "record_id": {
      "type": [
        "string",
        "null"
      ]
    },
    "record_type": {
      "enum": [
        "IMT-01",
        "IMT-02",
        "IMT-03",
        "IMT-04",
        "IMT-05",
        "IMT-06",
        "IMT-07",
        "IMT-08",
        "IMT-09",
        "IMT-10",
        "IMT-11",
        "IMT-12",
        "IMT-13",
        "IMT-14",
        "IMT-15",
        "IMT-16",
        "IMT-17",
        "IMT-18",
        "IMT-19",
        "IMT-20",
        "IMT-21",
        "IMT-22",
        "IMT-23",
        "IMT-24",
        "IMT-25",
        "IMT-26",
        "IMT-27",
        "IMT-28",
        "IMT-29",
        "IMT-30",
        "IMT-31",
        "IMT-32",
        "IMT-33",
        "IMT-34",
        "IMT-35",
        "IMT-36",
        "IMT-37",
        "IMT-38",
        "IMT-39",
        "IMT-40",
        "IMT-41",
        "IMT-42",
        "IMT-43",
        "IMT-44",
        "IMT-45",
        "IMT-46",
        "IMT-47",
        "IMT-48"
      ]
    },
    "schema_version": {
      "const": "IMT/0.9"
    },
    "created_at": {
      "type": [
        "string",
        "null"
      ],
      "format": "date-time"
    },
    "effective_at": {
      "type": [
        "string",
        "null"
      ],
      "format": "date-time"
    },
    "expires_at": {
      "type": [
        "string",
        "null"
      ],
      "format": "date-time"
    },
    "status": {
      "type": "string"
    },
    "normative_force": {
      "type": [
        "string",
        "null"
      ]
    },
    "authority_effect": {
      "enum": [
        "none",
        "advisory",
        "procedural_support",
        "evidentiary",
        "consent_evidence",
        "authority_reference",
        "authorizing",
        "activating",
        "executing",
        "closing"
      ]
    },
    "action_class": {
      "enum": [
        "A01",
        "A02",
        "A03",
        "A04",
        "A05",
        "A06",
        "A07",
        "A08",
        "A09",
        "A10",
        "A11",
        "A12",
        "A13",
        "A14",
        "A15",
        "A16"
      ]
    },
    "source_framework_id": {
      "const": "IMT"
    },
    "source_framework_version": {
      "const": "0.9"
    },
    "source_record_ids": {
      "type": "array",
      "items": {
        "type": "string"
      }
    },
    "supersedes": {
      "type": "array",
      "items": {
        "type": "string"
      }
    },
    "superseded_by": {
      "type": "array",
      "items": {
        "type": "string"
      }
    },
    "actor_id": {
      "type": [
        "string",
        "null"
      ]
    },
    "actor_type": {
      "type": [
        "string",
        "null"
      ]
    },
    "office_or_role": {
      "type": [
        "string",
        "null"
      ]
    },
    "representation_source": {
      "type": [
        "string",
        "null"
      ]
    },
    "technical_credential_refs": {
      "type": "array",
      "items": {
        "type": "string"
      }
    },
    "constituting_instrument": {
      "type": [
        "string",
        "null"
      ]
    },
    "legal_power": {
      "type": [
        "string",
        "null"
      ]
    },
    "jurisdiction_territorial": {
      "type": [
        "string",
        "null"
      ]
    },
    "jurisdiction_personal": {
      "type": [
        "string",
        "null"
      ]
    },
    "jurisdiction_subject_matter": {
      "type": [
        "string",
        "null"
      ]
    },
    "jurisdiction_temporal": {
      "type": [
        "string",
        "null"
      ]
    },
    "affected_party_refs": {
      "type": "array",
      "items": {
        "type": "string"
      }
    },
    "affected_indigenous_nation_refs": {
      "type": "array",
      "items": {
        "type": "string"
      }
    },
    "protected_domain_flags": {
      "type": "array",
      "items": {
        "type": "string"
      }
    },
    "consent_record_refs": {
      "type": "array",
      "items": {
        "type": "string"
      }
    },
    "authority_record_refs": {
      "type": "array",
      "items": {
        "type": "string"
      }
    },
    "activation_record_refs": {
      "type": "array",
      "items": {
        "type": "string"
      }
    },
    "access_class": {
      "type": [
        "string",
        "null"
      ]
    },
    "public_summary": {
      "type": [
        "string",
        "null"
      ]
    },
    "protected_annex_refs": {
      "type": "array",
      "items": {
        "type": "string"
      }
    },
    "data_purpose": {
      "type": [
        "string",
        "null"
      ]
    },
    "retention_rule": {
      "type": [
        "string",
        "null"
      ]
    },
    "correction_status": {
      "type": [
        "string",
        "null"
      ]
    },
    "challenge_status": {
      "type": [
        "string",
        "null"
      ]
    },
    "review_due_at": {
      "type": [
        "string",
        "null"
      ],
      "format": "date-time"
    },
    "closure_state": {
      "type": [
        "string",
        "null"
      ]
    },
    "unresolved_duty_refs": {
      "type": "array",
      "items": {
        "type": "string"
      }
    },
    "handoff_state": {
      "enum": [
        "offered",
        "acknowledged",
        "accepted",
        "partially_accepted",
        "capacity_limited",
        "refused",
        "deferred",
        "referred",
        "timed_out",
        "misrouted",
        "constitutional_gap",
        "returned",
        "closed",
        null
      ]
    },
    "recipient_refs": {
      "type": "array",
      "items": {
        "type": "string"
      }
    },
    "recipient_acceptance_refs": {
      "type": "array",
      "items": {
        "type": "string"
      }
    },
    "hashes_and_signatures": {
      "type": "object"
    },
    "human_accountable_officer": {
      "type": [
        "string",
        "null"
      ]
    },
    "prohibited_inferences": {
      "type": "array",
      "items": {
        "type": "string"
      }
    },
    "consequence_profile": {
      "enum": [
        "CP0",
        "CP1",
        "CP2",
        "CP3"
      ]
    },
    "authority_formation": {
      "enum": [
        "retained",
        "delegated",
        "transferred",
        "concurrent",
        "jointly_constituted",
        "absent",
        null
      ]
    },
    "response_duty_effect": {
      "enum": [
        "legal",
        "contractual",
        "charter_internal",
        "voluntary_commitment",
        "advisory",
        "none",
        null
      ]
    },
    "response_duty_source": {
      "type": [
        "string",
        "null"
      ]
    },
    "acknowledgment_clock_source": {
      "type": [
        "string",
        "null"
      ]
    },
    "decision_clock_source": {
      "type": [
        "string",
        "null"
      ]
    },
    "response_time_assessment_ref": {
      "type": [
        "string",
        "null"
      ]
    },
    "provisional_safe_state_record_ref": {
      "type": [
        "string",
        "null"
      ]
    },
    "post_acceptance_action_clock_ref": {
      "type": [
        "string",
        "null"
      ]
    },
    "imt_payload": {
      "type": "object",
      "minProperties": 1,
      "additionalProperties": true
    }
  },
  "allOf": [
    {
      "if": {
        "properties": {
          "consequence_profile": {
            "enum": [
              "CP2",
              "CP3"
            ]
          }
        }
      },
      "then": {
        "required": [
          "authority_formation",
          "response_duty_effect"
        ]
      }
    }
  ],
  "additionalProperties": false
}
