{
  "record_id": "IMT-EXAMPLE-001",
  "record_type": "IMT-08",
  "schema_version": "IMT/0.9",
  "created_at": "2026-08-06T00:00:00Z",
  "effective_at": null,
  "expires_at": "2026-11-06T00:00:00Z",
  "status": "published",
  "normative_force": "advisory",
  "authority_effect": "advisory",
  "action_class": "A01",
  "source_framework_id": "IMT",
  "source_framework_version": "0.9",
  "source_record_ids": [],
  "supersedes": [],
  "superseded_by": [],
  "actor_id": "tool-commons-steward",
  "actor_type": "organization",
  "office_or_role": "resource_card_steward",
  "representation_source": "published stewardship mandate",
  "technical_credential_refs": [],
  "constituting_instrument": null,
  "legal_power": null,
  "jurisdiction_territorial": null,
  "jurisdiction_personal": null,
  "jurisdiction_subject_matter": null,
  "jurisdiction_temporal": null,
  "affected_party_refs": [
    "community-users"
  ],
  "affected_indigenous_nation_refs": [],
  "protected_domain_flags": [],
  "consent_record_refs": [],
  "authority_record_refs": [],
  "activation_record_refs": [],
  "access_class": "public",
  "public_summary": "Resource card for a low-tech deliberation worksheet.",
  "protected_annex_refs": [],
  "data_purpose": "Tool discovery and burden disclosure.",
  "retention_rule": "Retain while current and archive superseded versions.",
  "correction_status": "current",
  "challenge_status": "open_to_correction",
  "review_due_at": "2026-11-01T00:00:00Z",
  "closure_state": "open",
  "unresolved_duty_refs": [],
  "handoff_state": null,
  "recipient_refs": [],
  "recipient_acceptance_refs": [],
  "hashes_and_signatures": {
    "sha256": "example-not-a-release-hash"
  },
  "human_accountable_officer": "resource-card-editor",
  "prohibited_inferences": [
    "Library presence does not establish authority or fitness."
  ],
  "consequence_profile": "CP1",
  "authority_formation": null,
  "response_duty_effect": null,
  "response_duty_source": null,
  "acknowledgment_clock_source": null,
  "decision_clock_source": null,
  "response_time_assessment_ref": null,
  "provisional_safe_state_record_ref": null,
  "post_acceptance_action_clock_ref": null,
  "imt_payload": {
    "tool_id": "deliberation-workbook",
    "version": "1.0",
    "analog_equivalent": "Printable and oral-facilitation versions",
    "estimated_burden": {
      "people": "2-12",
      "time": "60-120 minutes"
    },
    "exit_path": "Export notes and discontinue without platform dependency"
  }
}
