{
  "record_id": "IMT-EXAMPLE-002",
  "record_type": "IMT-29",
  "schema_version": "IMT/0.9",
  "created_at": "2026-08-06T00:00:00Z",
  "effective_at": null,
  "expires_at": "2026-11-06T00:00:00Z",
  "status": "capacity_limited",
  "normative_force": "advisory",
  "authority_effect": "authority_reference",
  "action_class": "A09",
  "source_framework_id": "IMT",
  "source_framework_version": "0.9",
  "source_record_ids": [],
  "supersedes": [],
  "superseded_by": [],
  "actor_id": "tool-commons-steward",
  "actor_type": "organization",
  "office_or_role": "resource_card_steward",
  "representation_source": "published stewardship mandate",
  "technical_credential_refs": [],
  "constituting_instrument": null,
  "legal_power": null,
  "jurisdiction_territorial": null,
  "jurisdiction_personal": null,
  "jurisdiction_subject_matter": null,
  "jurisdiction_temporal": null,
  "affected_party_refs": [
    "community-users"
  ],
  "affected_indigenous_nation_refs": [],
  "protected_domain_flags": [],
  "consent_record_refs": [],
  "authority_record_refs": [],
  "activation_record_refs": [],
  "access_class": "public",
  "public_summary": "The municipality retains jurisdiction but lacks accessibility staff and procurement capacity.",
  "protected_annex_refs": [],
  "data_purpose": "Tool discovery and burden disclosure.",
  "retention_rule": "Retain while current and archive superseded versions.",
  "correction_status": "current",
  "challenge_status": "open_to_correction",
  "review_due_at": "2026-11-01T00:00:00Z",
  "closure_state": "open",
  "unresolved_duty_refs": [],
  "handoff_state": "capacity_limited",
  "recipient_refs": [
    "municipal-implementation-office"
  ],
  "recipient_acceptance_refs": [
    "ack-2026-08-06"
  ],
  "hashes_and_signatures": {
    "sha256": "example-not-a-release-hash"
  },
  "human_accountable_officer": "resource-card-editor",
  "prohibited_inferences": [
    "Library presence does not establish authority or fitness."
  ],
  "consequence_profile": "CP2",
  "authority_formation": "retained",
  "response_duty_effect": "charter_internal",
  "response_duty_source": "municipal implementation charter §12",
  "acknowledgment_clock_source": "GMEAIA-07-ref-42",
  "decision_clock_source": "municipal charter §12",
  "response_time_assessment_ref": "GMEAIA-07-ref-42",
  "provisional_safe_state_record_ref": null,
  "post_acceptance_action_clock_ref": "implementation-clock-19",
  "imt_payload": {
    "jurisdiction_status": "recognized",
    "capacity_gap": [
      "sign-language interpretation",
      "accessible procurement support"
    ],
    "requested_support": [
      "temporary shared accessibility service"
    ],
    "constitutional_gap": false,
    "automatic_transfer": false
  }
}
